{
  "report_id": "imp-bootstrap-001",
  "snapshot_id": "snap-bootstrap-golden-001",
  "snapshot_digest": "sha256:0000000000000000000000000000000000000000000000000000000000000000",
  "boundary_id": "glt.bootstrap-slice@1",
  "mode": "change",
  "change": {
    "classifier_version": "1.0.0",
    "matrix_version": "1.0.0",
    "labels": ["interface"],
    "sources": [
      {
        "repository": "glt-controlplane",
        "path": "glt-specpack/docs/SPEC/registry.md",
        "authority": "glt-id-registry",
        "role": "changed"
      }
    ]
  },
  "affected_nodes": [
    "glt.controlplane.compiler",
    "glt.controlplane.registry.entry"
  ],
  "candidate_paths": [
    ["glt.controlplane.registry.entry", "glt.controlplane.compiler"]
  ],
  "required_checks": ["glt.controlplane.check"],
  "known_unknowns": [],
  "release": {
    "gate": "glt.controlplane.gate.bootstrap",
    "state": "pending",
    "reason": "required_checks_pending"
  },
  "coverage_not_established": false
}
